,source,author,title,description,url,urlToImage,publishedAt,content
0,"{'id': 'google-news-fr', 'name': 'Google News (France)'}",franceinfo,"REPLAY. ""L'année 2024 doit être une année de détermination"" : revivez les vœux du Nouvel An d'Emmanuel Macron - franceinfo",,https://news.google.com/rss/articles/CBMitQFodHRwczovL3d3dy5mcmFuY2V0dmluZm8uZnIvcG9saXRpcXVlL2VtbWFudWVsLW1hY3Jvbi9kaXJlY3Qtdi11eC1kLWVtbWFudWVsLW1hY3Jvbi1zdWl2ZXotbC1hbGxvY3V0aW9uLWR1LXByZXNpZGVudC1kZS1sYS1yZXB1YmxpcXVlLXBvdXItbGEtbm91dmVsbGUtYW5uZWUtYS0yMC1oZXVyZXNfNjI3NTU4Ni5odG1s0gEA?oc=5,,2023-12-31T20:25:47+00:00,
1,"{'id': 'les-echos', 'name': 'Les Echos'}",Grégoire Poussielgue,"Pour ses voeux aux Français, Emmanuel Macron veut faire de 2024 une « année de détermination »",Le président de la République a évoqué les prochaines élections européennes en parlant d'un « choix décisif ».,https://www.lesechos.fr/politique-societe/emmanuel-macron-president/pour-ses-voeux-aux-francais-emmanuel-macron-veut-faire-de-2024-une-annee-de-determination-2043820,https://media.lesechos.com/api/v1/images/view/6591c382cadd7516bd251308/1280x720/01001613737270-web-tete.jpg,2023-12-31T19:39:41Z,"L'année 2023 a été compliquée pour Emmanuel Macron, entre la contestation sociale contre la réforme des retraites, les émeutes urbaines du début de l'été ou encore les conséquences de la loi sur l'im… [+3382 chars]"
2,"{'id': 'google-news-fr', 'name': 'Google News (France)'}",Sud Ouest,Deux codétenus de la prison de Besançon retrouvés morts - Sud Ouest,,https://news.google.com/rss/articles/CBMiaWh0dHBzOi8vd3d3LnN1ZG91ZXN0LmZyL2ZhaXRzLWRpdmVycy9kZXV4LWNvZGV0ZW51cy1kZS1sYS1wcmlzb24tZGUtYmVzYW5jb24tcmV0cm91dmVzLW1vcnRzLTE3OTgyOTUzLnBocNIBAA?oc=5,,2023-12-31T18:14:45+00:00,
3,"{'id': 'google-news-fr', 'name': 'Google News (France)'}",Le Parisien,Paris : un homme arrêté après avoir agressé sexuellement une enfant de 7 ans au Trocadéro - Le Parisien,,https://news.google.com/rss/articles/CBMiqAFodHRwczovL3d3dy5sZXBhcmlzaWVuLmZyL2ZhaXRzLWRpdmVycy9wYXJpcy11bi1ob21tZS1hcnJldGUtYXByZXMtYXZvaXItYWdyZXNzZS1zZXh1ZWxsZW1lbnQtdW5lLWVuZmFudC1kZS03LWFucy1hdS10cm9jYWRlcm8tMzEtMTItMjAyMy1ETjU2T0VOWlVORVVaRFlMWUZRSUZYSkFPUS5waHDSAQA?oc=5,,2023-12-31T16:27:00+00:00,
4,"{'id': 'google-news-fr', 'name': 'Google News (France)'}",LaDepeche.fr,"Tempête Géraldine : rafales à plus de 130 m/h, vigilance orange, coupures d'électricité... Que sait-on de la perturbation ? - LaDepeche.fr",,https://news.google.com/rss/articles/CBMioAFodHRwczovL3d3dy5sYWRlcGVjaGUuZnIvMjAyMy8xMi8zMS90ZW1wZXRlLWdlcmFsZGluZS1yYWZhbGVzLWEtcGx1cy1kZS0xMzAtbWgtdmlnaWxhbmNlLW9yYW5nZS1jb3VwdXJlcy1kZWxlY3RyaWNpdGVxdWUtc2FpdC1vbi1kZS1sYS1wZXJ0dXJiYXRpb24tMTE2NzEyNjUucGhw0gEA?oc=5,,2023-12-31T15:56:00+00:00,
5,"{'id': 'google-news-fr', 'name': 'Google News (France)'}",Zone Militaire,Mer Rouge : Des hélicoptères de l'US Navy ont coulé trois embarcations Houthis après l'attaque d'un cargo - Zone Militaire,,https://news.google.com/rss/articles/CBMiiAFodHRwczovL3d3dy5vcGV4MzYwLmNvbS8yMDIzLzEyLzMxL21lci1yb3VnZS1kZXMtaGVsaWNvcHRlcmVzLWRlLWx1cy1uYXZ5LW9udC1jb3VsZS10cm9pcy1lbWJhcmNhdGlvbnMtaG91dGhpcy1hcHJlcy1sYXR0YXF1ZS1kdW4tY2FyZ28v0gEA?oc=5,,2023-12-31T12:00:26+00:00,
6,"{'id': 'le-monde', 'name': 'Le Monde'}",Benoît Grimonprez,« L’agrivoltaïsme suppose que l’agriculture conserve une place principale »,"Le juriste Benoît Grimonprez juge, dans une tribune au « Monde », que la réglementation en cours d’élaboration sur le statut de l’agrivoltaïsme en France va rendre inopérants tous les efforts fournis pour assurer son développement.",https://www.lemonde.fr/idees/article/2023/12/31/l-agrivoltaisme-suppose-que-l-agriculture-conserve-une-place-principale_6208540_3232.html,https://img.lemde.fr/2023/12/27/0/60/5577/3718/1440/960/60/0/970614e_1703693723436-pns-703263920.jpg,2023-12-31T11:30:06Z,Lagrivoltaïsme est la principale innovation de la loi du 10 mars 2023 relative à laccélération de la production dénergies renouvelables. La technique y est définie comme linstallation de modules phot… [+2450 chars]
7,"{'id': 'google-news-fr', 'name': 'Google News (France)'}",La Nouvelle République,Indre-et-Loire : un dispositif de sécurité renforcé pour la nuit du Nouvel An - La Nouvelle République,,https://news.google.com/rss/articles/CBMifmh0dHBzOi8vd3d3Lmxhbm91dmVsbGVyZXB1YmxpcXVlLmZyL2luZHJlLWV0LWxvaXJlL2luZHJlLWV0LWxvaXJlLXVuLWRpc3Bvc2l0aWYtZGUtc2VjdXJpdGUtcmVuZm9yY2UtcG91ci1sYS1udWl0LWR1LW5vdXZlbC1hbtIBAA?oc=5,,2023-12-31T11:13:59+00:00,
8,"{'id': 'les-echos', 'name': 'Les Echos'}",Martine Robert,"Artcurial, Sotheby's, Drouot : les maisons de vente peaufinent leur stratégie de marque",Le monde des enchères se sophistique et élargit sans cesse sa palette de services. Mais certains acteurs misent sur une marque unique quand d'autres préfèrent décliner une série d'enseignes spécialisées.,https://www.lesechos.fr/industrie-services/services-conseils/artcurial-sothebys-drouot-les-maisons-de-vente-peaufinent-leur-strategie-de-marque-2043802,https://media.lesechos.com/api/v1/images/view/65914459bf45892547318c4a/1280x720/01001500520256-web-tete.jpg,2023-12-31T10:37:07Z,"Dans le monde des enchères, les grandes maisons n'en finissent pas de s'adapter pour toucher toutes les cibles possibles. Elles sont devenues de véritables lieux culturels, à l'instar de Christie's P… [+3624 chars]"
9,"{'id': 'google-news-fr', 'name': 'Google News (France)'}",Mediapart,Ce qu'induit la saisine de la justice internationale à l'encontre d'Israël - Mediapart,,https://news.google.com/rss/articles/CBMifmh0dHBzOi8vd3d3Lm1lZGlhcGFydC5mci9qb3VybmFsL2ludGVybmF0aW9uYWwvMzExMjIzL2NlLXF1LWluZHVpdC1sYS1zYWlzaW5lLWRlLWxhLWp1c3RpY2UtaW50ZXJuYXRpb25hbGUtbC1lbmNvbnRyZS1kLWlzcmFlbNIBAA?oc=5,,2023-12-31T10:33:55+00:00,
10,"{'id': 'le-monde', 'name': 'Le Monde'}","Emeline Cazi, Nicolas Lepeltier","Pour Paris 2024, les chantiers olympiques arrivent dans les temps","Solideo, la société créée pour construire ou rénover en un temps record les équipements nécessaires à la compétition, a globalement tenu son échéance en livrant 84 % des travaux.",https://www.lemonde.fr/economie/article/2023/12/31/pour-paris-2024-les-chantiers-olympiques-arrivent-dans-les-temps_6208534_3234.html,https://img.lemde.fr/2023/12/30/0/0/1999/1333/1440/960/60/0/d1be229_1703931217069-bd-008-200920-dsc0205.jpg,2023-12-31T10:00:04Z,"Le village des athlètes, secteur des Quinconces (Seine-Saint-Denis), le 16 décembre 2023 CHRISTOPHE CAUDROY POUR « LE MONDE »
Un homme savourait plus que les autres cette rencontre organisée mardi 1… [+2617 chars]"
11,"{'id': 'google-news-fr', 'name': 'Google News (France)'}",Le Figaro,"Légion d'honneur : Bernard Arnault, Liane Foly, Jean-Louis Borloo... Découvrez la liste des promus du 1er janvier - Le Figaro",,https://news.google.com/rss/articles/CBMinAFodHRwczovL3d3dy5sZWZpZ2Fyby5mci9hY3R1YWxpdGUtZnJhbmNlL2xlZ2lvbi1kLWhvbm5ldXItYmVybmFyZC1hcm5hdWx0LWxpYW5lLWZvbHktamVhbi1sb3Vpcy1ib3Jsb28tZGVjb3V2cmV6LWxhLWxpc3RlLWRlcy1wcm9tdXMtZHUtMWVyLWphbnZpZXItMjAyMzEyMzHSAQA?oc=5,,2023-12-31T09:42:58+00:00,
12,"{'id': 'les-echos', 'name': 'Les Echos'}",,FIL INFO - Eurostar : le trafic a repris normalement ce dimanche,"En raison d'une fermeture des voies près de Londres, tous les trains Eurostar ont été annulés ce samedi, bloquant environ 30.000 passagers à la veille des festivités du Nouvel An.",https://www.lesechos.fr/monde/enjeux-internationaux/direct-les-principales-informations-de-ce-dimanche-31-decembre-2043796,https://media.lesechos.com/api/v1/images/view/657a9a2a0075831838101e58/1280x720/0902711916839-web-tete.jpg,2023-12-31T09:04:38Z,"Bourse, vie des entreprises, événements internationaux Toutes les infos de ce dernier jour de l'année 2023 sont à suivre dans notre Fil.
&gt; Les principales informations de ce dimanche 31 décembre… [+5134 chars]"
13,"{'id': 'les-echos', 'name': 'Les Echos'}",Les Echos,La Bulgarie et la Roumanie vont partiellement intégrer l'espace Schengen,"Les 27 Etats membres de l'UE se sont mis d'accord dans la nuit, et à l'unanimité, pour lever les contrôles aux frontières aériennes et maritimes, internes à l'UE, de ces deux pays à compter du 31 mars. La décision était, jusqu'à présent, bloquée par l'Autrich…",https://www.lesechos.fr/monde/europe/la-bulgarie-et-la-roumanie-vont-partiellement-integrer-lespace-schengen-2043797,https://media.lesechos.com/api/v1/images/view/65912da600d5232c1b0fd8a7/1280x720/01001600098539-web-tete.jpg,2023-12-31T09:00:17Z,"La Bulgarie et la Roumanie vont partiellement intégrer l'espace Schengen de libre circulation dans l'Union européenne, à partir du 31 mars, ont annoncé les 27 dans la nuit de samedi à dimanche. Cette… [+1842 chars]"
14,"{'id': 'google-news-fr', 'name': 'Google News (France)'}",FRANCE 24,L'année 2023 en dix grands événements - FRANCE 24,,https://news.google.com/rss/articles/CBMiZ2h0dHBzOi8vd3d3LmZyYW5jZTI0LmNvbS9mci9zdXItZnJhbmNlLTI0LzIwMjMxMjMxLWwtYW5uJUMzJUE5ZS0yMDIzLWVuLWRpeC1ncmFuZHMtJUMzJUE5diVDMyVBOW5lbWVudHPSAQA?oc=5,,2023-12-31T07:03:29+00:00,
15,"{'id': 'le-monde', 'name': 'Le Monde'}",Rafaële Rivais,Quand la sortie du réveillon est gâchée par le verglas,L’assureur d’une villa dont la terrasse glissante a causé la chute d’un invité doit indemniser le préjudice corporel de celui-ci.,https://www.lemonde.fr/argent/article/2023/12/31/quand-la-sortie-du-reveillon-est-gachee-par-le-verglas_6208520_1657007.html,https://img.lemde.fr/2023/04/17/0/0/3000/2000/1440/960/60/0/0265484_1681719509366-immobilier-01.jpg,2023-12-31T07:00:09Z,"Ce nest pas parce quà la Saint-Sylvestre, on se souhaite « bonne année et bonne santé » que lon est à labri dun accident. M. X en sait quelque chose, lui qui, en sortant du réveillon du Jour de lan 2… [+2518 chars]"
16,"{'id': 'le-monde', 'name': 'Le Monde'}",Gabriel Richalot,Paris 2024 : « Quand la magie du sport opère »,"En devenant championnes du monde de handball, le 17 décembre, les handballeuses françaises ont rappelé la capacité des belles victoires sportives à reléguer au second plan les problèmes. Il faudra d’autres succès de ce type lors de l’année qui s’ouvre.",https://www.lemonde.fr/sport/article/2023/12/31/paris-2024-quand-la-magie-du-sport-opere_6208517_3242.html,https://img.lemde.fr/2023/12/17/0/0/8256/5504/1440/960/60/0/172e327_5144177-01-06.jpg,2023-12-31T06:00:03Z,"Cest dHerning, une ville du Danemark denviron 90 000 habitants, située à 1 227 kilomètres par la route de Saint-Denis (Seine-Saint-Denis) et du siège du Comité dorganisation des Jeux olympiques et pa… [+3417 chars]"
17,"{'id': 'google-news-fr', 'name': 'Google News (France)'}",Le Monde,L'espace Schengen s'ouvrira partiellement à la Bulgarie et la Roumanie à partir du 31 mars - Le Monde,,https://news.google.com/rss/articles/CBMipAFodHRwczovL3d3dy5sZW1vbmRlLmZyL2ludGVybmF0aW9uYWwvYXJ0aWNsZS8yMDIzLzEyLzMxL2wtZXNwYWNlLXNjaGVuZ2VuLXMtb3V2cmlyYS1wYXJ0aWVsbGVtZW50LWEtbGEtYnVsZ2FyaWUtZXQtbGEtcm91bWFuaWUtYS1wYXJ0aXItZHUtMzEtbWFyc182MjA4NDYwXzMyMTAuaHRtbNIBAA?oc=5,,2023-12-31T02:45:36+00:00,
18,"{'id': 'le-monde', 'name': 'Le Monde'}",Le Monde,Depardieu : la faute politique du président,On connaît le goût d’Emmanuel Macron pour le « en même temps ». La présomption d’innocence qu’il a invoquée est évidemment un principe à défendre. Mais proclamer sa fierté pour un homme qui étale régulièrement son mépris pour la France et son admiration pour …,https://www.lemonde.fr/idees/article/2023/12/30/depardieu-la-faute-politique-du-president-macron_6208407_3232.html,https://img.lemde.fr/2023/12/20/0/0/7980/5320/1440/960/60/0/23a82f5_5167532-01-06.jpg,2023-12-30T10:00:05Z,"Depuis 2017 et les révélations sur le producteur de cinéma prédateur Harvey Weinstein, la vague qui a libéré la parole des femmes victimes de violences sexistes et sexuelles a aussi bouleversé la man… [+3427 chars]"
19,"{'id': 'les-echos', 'name': 'Les Echos'}",Les Echos,VIDEO - Pourquoi l'Argentine manifeste contre le « mega-décret » de son nouveau président ?,"Les Argentins sont dans la rue, protestant contre les mesures annoncées par Javier Milei. C'est la première fois en quarante ans de démocratie qu'un président argentin doit faire face à une grève générale moins d'un mois après son arrivée au pouvoir.",https://www.lesechos.fr/monde/ameriques/video-pourquoi-largentine-manifeste-contre-le-mega-decret-de-son-nouveau-president-2043712,https://media.lesechos.com/api/v1/images/view/658ea786bf70e01c5c71ab89/1280x720/01001536310053-web-tete.jpg,2023-12-29T11:03:28Z,"Des milliers de personnes ont manifesté mercredi à Buenos Aires, donnant lieu à des bousculades avec la police et des interpellations. C'était le troisième rassemblement en huit jours contre un décre… [+999 chars]"
0,"{'id': 'le-monde', 'name': 'Le Monde'}",Bertrand Monnet et Karim El Hadj,Vidéo. Les coulisses de notre enquête « Narco Business » sur le trafic de fentanyl des cartels mexicains,"Vidéo - Bertrand Monnet, professeur à l’Edhec, répond aux questions des internautes sur la conception de son enquête  pour « Le Monde » au cœur du cartel de Sinaloa.",https://www.lemonde.fr/international/video/2023/12/28/les-coulisses-de-notre-enquete-narco-business-sur-le-trafic-de-fentanyl-des-cartels-mexicains_6208133_3210.html,https://img.lemde.fr/2023/12/28/58/0/1920/1280/1440/960/60/0/337cda7_1703780228011-thumbnail-narco-making-of-ok.png,2023-12-28T16:26:11Z,"Comment est-ce quon mène lenquête au sein dun cartel méxicain ? Bertrand Monnet, spécialiste de léconomie du crime, répond aux questions des internautes sur les coulisses de « Narco Business », son e… [+641 chars]"
1,"{'id': 'le-monde', 'name': 'Le Monde'}",Service vidéo du Monde,"Vidéo. A Gaza, des corps enterrés dans des fosses communes, tandis que la riposte israélienne s’intensifie","Vidéo - Depuis le 7 octobre, les Palestiens ne cessent de compter les morts, alors qu’Israël continue son offensive, en représailles à l’attaque du Hamas.",https://www.lemonde.fr/international/video/2023/12/28/a-gaza-des-corps-enterres-dans-des-fosses-communes-tandis-que-la-riposte-israelienne-s-intensifie_6208111_3210.html,https://img.lemde.fr/2023/12/26/0/0/5760/3840/1440/960/60/0/c2c3ed5_86198a3f5e814e789024198fddcc7b5e-0-ccb980d5067f455e9a61df90c9eeba79.jpg,2023-12-28T13:12:15Z,"A Rafah, mardi 26 octobre, les autorités ont enterré les corps de 80 Palestiniens tués dans la bande de Gaza. Dans le même temps, Benyamin Nétanyahou avait annoncé « lintensification » des combats da… [+318 chars]"
2,"{'id': 'les-echos', 'name': 'Les Echos'}",Yves Bourdillon,La Moldavie veut accélérer son rapprochement de l'Union européenne,"La présidente de ce petit pays roumanophone, incorporé jadis dans l'empire russe, compte organiser un référendum sur l'adhésion à l'Union européenne.",https://www.lesechos.fr/monde/europe/la-moldavie-veut-accelerer-son-rapprochement-de-lunion-europeenne-2043306,https://media.lesechos.com/api/v1/images/view/658b14df4a2aeb60717e32cb/1280x720/01001439168215-web-tete.jpg,2023-12-26T18:00:57Z,"La Moldavie a rapidement embrayé. Dix jours après avoir bénéficié, comme son voisin ukrainien, d'une invitation des Vingt-Sept à entamer des négociations d'adhésion à l'Union européenne , la présiden… [+3289 chars]"
3,"{'id': 'les-echos', 'name': 'Les Echos'}",Les Echos,"Les images impressionnantes de l'explosion d'un navire russe dans le port de Feodossia, en Crimée","L'Ukraine affirme avoir détruit le Novocherkassk, un bâtiment de la marine russe en Crimée, dans le port de Feodossia. Le ministère russe de la Défense déclare, de son côté, que le navire est « endommagé ».",https://www.lesechos.fr/monde/europe/les-images-impressionnantes-de-lexplosion-dun-navire-russe-dans-le-port-de-feodossia-en-crimee-2043244,https://media.lesechos.com/api/v1/images/view/658abf482320f600fe702267/1280x720/01001435390282-web-tete.jpg,2023-12-26T11:55:48Z,"Une impressionnante explosion a retenti ce mardi dans le port de Feodossia, en Crimée, aux alentours de 02h30 heure locale. Une boule de feu a déchiré le ciel, pulvérisant des débris à plusieurs kilo… [+1059 chars]"
4,"{'id': 'les-echos', 'name': 'Les Echos'}",Manon de Cabarrus,VIDEO - Pourquoi l'enlisement de la guerre en Ukraine est la meilleure chose qui pouvait arriver à la Russie,"Alors que la neige est de retour en Ukraine, le conflit s'est enlisé. Les soldats se sont enterrés dans des tranchées, dans une guerre de position où aucune des deux armées n'a de réel avantage technologique sur l'autre. Les Russes pourraient profiter de cet …",https://www.lesechos.fr/monde/enjeux-internationaux/video-pourquoi-lenlisement-de-la-guerre-en-ukraine-est-la-meilleure-chose-qui-pouvait-arriver-a-la-russie-2042887,https://media.lesechos.com/api/v1/images/view/65847244a9a3e9445c2eb969/1280x720/01001279404138-web-tete.jpg,2023-12-21T17:13:36Z,"L'hiver est arrivé en Ukraine, et la contre-offensive n'a pas donné de grands résultats. La ligne de front s'est stabilisée et le conflit est devenu une guerre d'usure. La Russie peut mobiliser davan… [+2132 chars]"
5,"{'id': 'le-monde', 'name': 'Le Monde'}",,Vidéo. Israël-Palestine : que veut vraiment le Hamas ?,"Vidéo - Le groupe islamiste a beaucoup évolué depuis sa création en 1987, et a tenu des discours parfois très contradictoires.",https://www.lemonde.fr/international/video/2023/12/18/israel-palestine-que-veut-vraiment-le-hamas_6206471_3210.html,https://img.lemde.fr/2023/12/15/0/0/5439/3626/1440/960/60/0/c7ca6a9_5124923-01-06.jpg,2023-12-18T10:53:13Z,"<li>Parce quune autre personne (ou vous) est en train de lire Le Monde avec ce compte sur un autre appareil.
Vous ne pouvez lire Le Monde que sur un seul appareil à la fois (ordinateur, téléphone ou… [+626 chars]"
6,"{'id': 'les-echos', 'name': 'Les Echos'}",Les Echos,"VIDEO - Démographie : faire moins d'enfants, est-ce vraiment un problème ?","Qui dit moins de naissances, dit baisse du nombre d'actifs, dit pression sur l'équilibre des comptes sociaux. Alors a-t-on raison de s'alarmer ? Quelles solutions existent pour pallier le manque de naissances ? Est-ce vraiment grave de moins faire d'enfants ?",https://www.lesechos.fr/politique-societe/societe/video-demographie-la-baisse-de-la-natalite-est-elle-vraiment-un-probleme-2042008,https://media.lesechos.com/api/v1/images/view/658018697685f60c2628b16c/1280x720/01001157183372-web-tete.jpg,2023-12-18T10:04:00Z,"La chute est nette et claire : les Françaises font moins de bébés. En 10 ans, la France est passée de 830.000 à 720.000 naissances annuelles. Et en 2023, le décrochage est encore plus fort, avec une … [+1518 chars]"
7,"{'id': 'le-monde', 'name': 'Le Monde'}",Philippe Escande,"Google, Apple vs Epic Games : « Le monopole des géants du numérique s’érode trop doucement »","Epic Games (« Fortnite ») vient de gagner son procès contre Google, accusé d’abus de monopole. L’éditeur avait perdu dans un procès précédent sur de mêmes griefs, contre Apple cette fois. Le chemin sera long pour éroder les rentes phénoménales des deux géants…",https://www.lemonde.fr/economie/article/2023/12/13/google-apple-vs-epic-games-le-monople-des-geants-du-numerique-s-erode-trop-doucement_6205567_3234.html,https://img.lemde.fr/2023/12/12/0/136/4506/3004/1440/960/60/0/e7200bb_5095845-01-06.jpg,2023-12-13T10:47:51Z,"Le droit et la justice sont le fondement de la vie en société, mais les juges sont des humains comme les autres et la constance de leurs décisions na rien de mécanique. Cette inconstance de la justic… [+2451 chars]"
8,"{'id': 'les-echos', 'name': 'Les Echos'}",Manon de Cabarrus,VIDEO - Cet avion militaire américain qui pourrait révolutionner la guerre,"Le nouvel avion américain B-21 Raider a fait son premier vol d'essai en Californie. Il s'agit du premier avion de chasse de sixième génération à effectuer ses tests en vol. Sans équipage, boosté à l'IA… Ce que l'on sait sur le nouveau prodige de l'armée de l'…",https://www.lesechos.fr/industrie-services/air-defense/video-cet-avion-militaire-americain-qui-pourrait-revolutionner-la-guerre-2038951,https://media.lesechos.com/api/v1/images/view/656da19218441762e76f9bbc/1280x720/0100682052598-web-tete.jpg,2023-12-04T09:53:16Z,"C'est le premier avion de chasse de sixième génération jamais vu en vol : le B-21 américain, conçu pour pouvoir voler sans équipage, possède un système de liaison des données grâce au cloud, une auto… [+1231 chars]"
9,"{'id': 'le-monde', 'name': 'Le Monde'}","Anna Moreau, Elsa Longueville et Mahé Richard-Schmidt","Vidéo. Bande de Gaza : avant la guerre, un territoire à l’agonie","Vidéo - Grâce à une cartographie précise du territoire et de nombreuses données méconnues, « Le Monde » revient sur les trente années d’isolement et de dénuement de l’enclave qui ont précédé la guerre entre Israël et le Hamas.",https://www.lemonde.fr/international/video/2023/11/18/bande-de-gaza-avant-la-guerre-un-territoire-a-l-agonie_6200961_3210.html,https://img.lemde.fr/2023/11/16/137/400/1847/1231/1440/960/60/0/3543345_1700152775028-thumbnail-gaza-calvaire-sirius-copie.png,2023-11-18T15:00:09Z,"La bande de Gaza na pas connu de répit depuis les années 1950. Coincé entre Israël et lEgypte, soumis à une succession de guerres et doccupations, ce morceau de Palestine parvient à peine survivre. D… [+2162 chars]"
10,"{'id': 'liberation', 'name': 'Libération'}",Elsa Maudet,"Précarité énergétique : «Les journées où il pleut tout le temps, c’est un peu l’enfer»","Comme 3,5 millions de ménages français, Valérie et David peinent à combattre l'humidité et les fuites dans leur maison. Pour financer les travaux, ils sont accompagnés par une association spécialisée.",http://www.liberation.fr/france/2021/02/02/precarite-energetique-les-journees-ou-il-pleut-tout-le-temps-c-est-un-peu-l-enfer_1819030,https://medias.liberation.fr/photo/1375474-2021-02-margueritebornhauser-compiegnes-10jpg.jpg?modified_at=1612265502&amp;picto=fb&amp;ratio_x=191&amp;ratio_y=100&amp;width=1080,2021-02-02T12:49:24Z,"Search
Direct
User
100
Zoom
Quiz
?
Libération Diamond
clock
xml
netvibes
live
anciens-numeros
data
desintox
diapo
edito
election-2017
election
essentiel
generique
idee
jo
next… [+467 chars]"
11,"{'id': 'liberation', 'name': 'Libération'}",Chez Pol,Ces députés qui ne veulent pas plus d’argent,"Indiscrétions piquantes, maladresses vaches ou douces confessions : chaque jour, retrouvez les brèves qui auscultent le monde politique.",http://www.liberation.fr/politiques/2021/02/02/ces-deputes-qui-ne-veulent-pas-plus-d-argent_1819029,https://medias.liberation.fr/photo/1375467-afp_1r32kgjpg.jpg?modified_at=1612264960&amp;picto=fb&amp;ratio_x=191&amp;ratio_y=100&amp;width=1080,2021-02-02T12:22:45Z,"Search
Direct
User
100
Zoom
Quiz
?
Libération Diamond
clock
xml
netvibes
live
anciens-numeros
data
desintox
diapo
edito
election-2017
election
essentiel
generique
idee
jo
next… [+476 chars]"
12,"{'id': 'liberation', 'name': 'Libération'}",Emma Donada,Covid-19 : vers un dépistage systématique des variants en cas de test PCR positif,"Le 23 janvier, la direction générale de la santé a demandé aux professionnels de santé de faire passer un deuxième test à toutes les PCR positives afin de détecter les éventuels variants.",http://www.liberation.fr/checknews/2021/02/02/covid-19-vers-un-depistage-systematique-des-variants-en-cas-de-test-pcr-positif_1818898,https://medias.liberation.fr/photo/1375347-checknews_afp_8yf6bbjpg.jpg?modified_at=1612262533&amp;picto=fb&amp;ratio_x=191&amp;ratio_y=100&amp;width=1080,2021-02-02T11:42:53Z,"Search
Direct
User
100
Zoom
Quiz
?
Libération Diamond
clock
xml
netvibes
live
anciens-numeros
data
desintox
diapo
edito
election-2017
election
essentiel
generique
idee
jo
next… [+467 chars]"
13,"{'id': 'liberation', 'name': 'Libération'}",Victor Boiteau,"Domaines de chasse : en Sologne, les grillages de la discorde","Dans cette région boisée du Centre-Val-de-Loire, l’engrillagement de vastes parcs réservées à la chasse s’accélère. Une pratique légale, mais qui perturbe la circulation des animaux. Et défigure le territoire, selon les associations et les chasseurs locaux.",http://www.liberation.fr/france/2021/02/02/domaines-de-chasse-en-sologne-les-grillages-de-la-discorde_1818950,https://medias.liberation.fr/photo/1375459-prodlibe-2021-0255.jpg?modified_at=1612252986&amp;picto=fb&amp;ratio_x=191&amp;ratio_y=100&amp;width=1080,2021-02-02T09:50:51Z,"Search
Direct
User
100
Zoom
Quiz
?
Libération Diamond
clock
xml
netvibes
live
anciens-numeros
data
desintox
diapo
edito
election-2017
election
essentiel
generique
idee
jo
next… [+467 chars]"
