,source,author,title,description,url,urlToImage,publishedAt,content
0,"{'id': 'google-news-fr', 'name': 'Google News (France)'}",,Google News,"Comprehensive up-to-date news coverage, aggregated from sources all over the world by Google News.",https://news.google.com/rss/articles/CBMi2gJBVV95cUxOTmh2dXE1WXJHRmZFTE0ycXYxanJweHFEOVRmNmxSU0ZITDBUbnlSMmVaRjJGMG5EcEVQR3plOVNwdnF6cUdpbUl3bXZNY0VYSDFsaEs3M3ctTUt2VVNlbHlHS2EzQ19TRUZFR2JxZjlSNGROR0RSTHgtdzMtc1A2VE8wTWlfVDktRlltd3o4WjdYYzAxazVoSmxMeG9sbDdjbk1LclRrTTAyR0JHeDk3ek5fcFdoU2ZHLVUtMndST21BWUNkRVRBcnJLcU1nMjFKNFNlYUdydnJaemxaVDhkVnFmcWdVSXBjVDZYSktPWnd3ZFo0RHJ2SC1QaHFMX1J4SnRFOE0yUTQ4YkEtclhzRlBJQmx2a295YnBwQ1pVRzREV0pmaGU5NzUtLTdsUU5BWVdXZ3NWZFhBQmVjT3dyVDBITEJMa1JvU0FJR0FYd0FxLVJJNkFTNzBn,https://lh3.googleusercontent.com/J6_coFbogxhRI9iM864NL_liGXvsQp2AupsKei7z0cNNfDvGUmWUy20nuUhkREQyrpY4bEeIBuc=s0-w300-rw,2025-01-15T23:26:15+00:00,"Comprehensive up-to-date news coverage, aggregated from sources all over the world by Google News."
1,"{'id': 'google-news-fr', 'name': 'Google News (France)'}",,Google News,"Comprehensive up-to-date news coverage, aggregated from sources all over the world by Google News.",https://news.google.com/rss/articles/CBMihwJBVV95cUxQRlhNbTJFNjBDaUUxT01aWVppQ0tWcXhNWjNrUHBHMzhJTWp4bHVlT195amdfTnVZNjA1a2NsSTB6VlVnd25OeXAyYXo5VDZtc3dERTA4LWVPVEV6THZid1hxcWFEWEQ5cmhpNkVNaWJiV082amZQZDRySnhJbnZzTzcyY1k2aHVrcHpISlAyUUFrZzg5YkxFRHVHd1Jzb2dIQmlob213V1pTRkFtcjZmYjlHY2FGRDFCS1pwRnNtNXB0NW5CYzlydjc2YzMyMlNvNVA0eWZ2T19URVFZVDdVTFdoa3dFOTdxOS0tU0Z3SzZTbmV3UmZkVmhPV3J3RTRBQXlweVlXcw,https://lh3.googleusercontent.com/J6_coFbogxhRI9iM864NL_liGXvsQp2AupsKei7z0cNNfDvGUmWUy20nuUhkREQyrpY4bEeIBuc=s0-w300-rw,2025-01-15T19:07:30+00:00,"Comprehensive up-to-date news coverage, aggregated from sources all over the world by Google News."
2,"{'id': 'google-news-fr', 'name': 'Google News (France)'}",,Google News,"Comprehensive up-to-date news coverage, aggregated from sources all over the world by Google News.",https://news.google.com/rss/articles/CBMizAFBVV95cUxPeXlCbndqNy01TUJ5SEsxNmhNMkFnd2tFNkczd3R6Tl9nSkUyUUE4eExqalg5R0RaUlNIQy1aOVJHY2MwNTFxZ0dweXl5MDJ2RzNtMzJGbXlra19GSUdyV2FRNHBDY0ZhVHhLTDVKRGtUZmxVVVFYMjZFSEt5U0J6bDhlajh3Y3VpRXF2SWJzeHpBNFBBdC1wd25yT1YzT2prOUFQUTc3TzJxRGJPclRPTGhyMkxrN1JOMEtxbW9IeEFrZVRKVnhzclZyQ1c,https://lh3.googleusercontent.com/J6_coFbogxhRI9iM864NL_liGXvsQp2AupsKei7z0cNNfDvGUmWUy20nuUhkREQyrpY4bEeIBuc=s0-w300-rw,2025-01-15T18:59:29+00:00,"Comprehensive up-to-date news coverage, aggregated from sources all over the world by Google News."
3,"{'id': 'google-news-fr', 'name': 'Google News (France)'}",,Google News,"Comprehensive up-to-date news coverage, aggregated from sources all over the world by Google News.",https://news.google.com/rss/articles/CBMiggJBVV95cUxNYkdqRWpMNEM0bVpqdTZKYTV3djdQT3o1NEZteXRPT2doNnZFdFdaRU9aeGxLTXQtOEQwTFFfUEZSaGlwZldqQ2x4ZWt0Y0FKeE9iVTRDX1p3TFJiN09qdjFfYlFaVFVma3M3TmptaFNtRTdnMXkzanRDeUxoQTU5TTJySGdLQUxUcGdmTHMwVzk4cy1HeG9JOWFxU0Q1alh5SmtZMTd0NjNpWC1MQUlIMEtTWTlVU2pzdDdVZEpCa0hmbGpDWUNpeXQtUkZsN2pDZU81SnM0MUlSS0RMN2VNQmpUVTQ4OGhkU2JsYkFSdWI2SE9FM2hRRkllUFo3R0lTYWc,https://lh3.googleusercontent.com/J6_coFbogxhRI9iM864NL_liGXvsQp2AupsKei7z0cNNfDvGUmWUy20nuUhkREQyrpY4bEeIBuc=s0-w300-rw,2025-01-15T18:20:59+00:00,"Comprehensive up-to-date news coverage, aggregated from sources all over the world by Google News."
4,"{'id': 'les-echos', 'name': 'Les Echos'}","Grégoire Poussielgue, Solenn Poullennec",François Bayrou tente d'acheter au prix fort la non-censure des socialistes,"S'il refuse toujours de suspendre la réforme des retraites, comme souhaité par les socialistes, le Premier ministre a promis de présenter une loi même si les syndicats et le patronat s'entendent seulement sur des changements limités.",https://www.lesechos.fr/politique-societe/gouvernement/francois-bayrou-tente-dacheter-au-prix-fort-la-non-censure-des-socialistes-2142796,https://media.lesechos.com/api/v1/images/view/6787fb532cce0e0eb11dbe49/1280x720/01303470888270-web-tete.jpg,2025-01-15T18:15:43Z,François Bayrou a inventé le concept de la déclaration de politique générale évolutive. But de l'opération : obtenir coûte que coûte que les députés socialistes ne votent pas la motion de censure que… [+4996 chars]
5,"{'id': 'google-news-fr', 'name': 'Google News (France)'}",,Google News,"Comprehensive up-to-date news coverage, aggregated from sources all over the world by Google News.",https://news.google.com/rss/articles/CBMiqAFBVV95cUxPWkdpQ1E4RVI3N3FHWkhmcTEzOFJ4aGIwVlVQZmh2eWlhbkdTNTRBMy1ZX0NQQXNBcjlFUEZCc1JPY0hNb0luTEFNMFZ1bl9jR1MzWU5LZF84d3ZpNFpGaUtFRDhuM09LcldjM3ROam9MQmsxczRpLTZUaGxBa3JrTGRrRk1BLVluOGpWZ0MtZ3RmQUZONk1BWnNtNFhHSDdtWWh0WHRHS2g,https://lh3.googleusercontent.com/J6_coFbogxhRI9iM864NL_liGXvsQp2AupsKei7z0cNNfDvGUmWUy20nuUhkREQyrpY4bEeIBuc=s0-w300-rw,2025-01-15T18:00:00+00:00,"Comprehensive up-to-date news coverage, aggregated from sources all over the world by Google News."
6,"{'id': 'les-echos', 'name': 'Les Echos'}",Pascal Brunel,Accord de cessez-le-feu à Gaza après 15 mois de guerre,"Israël et le Hamas sont parvenus mercredi par l'entremise du Qatar et des Etats-Unis à un accord de cessez-le-feu dans un premier temps de 42 jours, ainsi que sur la libération de 33 des 98 otages détenus par le Hamas.",https://www.lesechos.fr/monde/afrique-moyen-orient/accord-de-cessez-le-feu-a-gaza-apres-15-mois-de-guerre-2142787,https://media.lesechos.com/api/v1/images/view/6787f6a7af4c587f101d5a5a/1280x720/01303477586252-web-tete.jpg,2025-01-15T17:55:46Z,"Après plus de 15 mois de guerre, Israël et le Hamas ont conclu mercredi un accord sur un cessez-le-feu de 42 jours durant lesquels 33 des otages détenus par les islamistes palestiniens seront libérés… [+3425 chars]"
7,"{'id': 'les-echos', 'name': 'Les Echos'}",Cécile Cornudet,Bayrou : La séance de rattrapage,"Faute d'avoir présenté l'accord avec le PS comme il était prévu qu'il le soit, le Premier ministre est revenu sur sa déclaration de politique générale pour la préciser et allonger la liste des concessions. Inédit.",https://www.lesechos.fr/politique-societe/gouvernement/bayrou-la-seance-de-rattrapage-2142784,https://media.lesechos.com/api/v1/images/view/6769b89501a20c4b0c04f569/1280x720/01302406925622-web-tete.jpg,2025-01-15T17:51:02Z,"Que se passe-t-il quand l'exécuteur d'un plan sort du chemin préparé ? Il s'y reprend à deux fois, comme François Bayrou contraint à une DPG bis (déclaration de politique générale) au Sénat ce mercre… [+2812 chars]"
8,"{'id': 'les-echos', 'name': 'Les Echos'}",Tifenn Clinkemaillié,Assurance-vie : les rendements des fonds en euros reprennent l'avantage sur le Livret A,"Alors que le taux du livret d'épargne réglementée baissera au 1 er février à 2,4 %, les assureurs ont présenté des rendements proches - voire supérieurs - sur les fonds en euros pour l'année 2024. Une performance qu'ils espèrent reproduire en 2025.",https://www.lesechos.fr/finance-marches/banque-assurances/assurance-vie-les-rendements-des-fonds-en-euros-reprennent-lavantage-sur-le-livret-a-2142774,https://media.lesechos.com/api/v1/images/view/6787f1a6c85116268e595ea9/1280x720/01303420433206-web-tete.jpg,2025-01-15T17:34:25Z,"Livret A ou assurance-vie, qui sera le mieux-disant ? Les deux produits, parmi les placements préférés des Français, ne présentent pas les mêmes caractéristiques et avantages. Mais la bataille semble… [+3413 chars]"
9,"{'id': 'les-echos', 'name': 'Les Echos'}",Stéphane Loignon,Budget 2025 : comment le gouvernement compte économiser 30 milliards d'euros,"Pour ramener le déficit à 5,4 % cette année malgré une conjoncture morose, le gouvernement Bayrou veut privilégier les baisses de dépenses. Sur les plus de 30 milliards d'euros d'économies visées, l'Etat devra en assumer la plus grande part - 23 milliards d'e…",https://www.lesechos.fr/economie-france/budget-fiscalite/budget-2025-comment-le-gouvernement-compte-economiser-30-milliards-deuros-2142770,https://media.lesechos.com/api/v1/images/view/6787f04d8896227ef073e719/1280x720/01303473256370-web-tete.jpg,2025-01-15T17:28:39Z,"L'Etat va devoir se serrer la ceinture, du moins si le projet de budget de François Bayrou est adopté. L'exécutif, qui veut ramener le déficit à 5,4 % du PIB en 2025 (contre 6,1 % l'an passé), a deva… [+3524 chars]"
10,"{'id': 'les-echos', 'name': 'Les Echos'}",Dominique Seux,Vigilance fiscale,Les changements de pied au jour le jour sur les impôts sont insensés.,https://www.lesechos.fr/idees-debats/editos-analyses/vigilance-fiscale-2142769,https://media.lesechos.com/api/v1/images/view/67854da50b6f6162e779534e/1280x720/01303376898854-web-tete.jpg,2025-01-15T17:28:34Z,"On connaît depuis le mois de décembre le coût pour la France de la motion de censure qui a renversé Michel Barnier : incertitude politique et économique, panne des investissements et de la consommati… [+1453 chars]"
11,"{'id': 'les-echos', 'name': 'Les Echos'}",Sébastien Dumoulin,L'impôt minimum sur les hauts revenus fait son come-back,"La contribution différentielle sur les hauts revenus (CDHR), imaginée par le gouvernement Barnier, sera finalement reprise par François Bayrou. Elle s'appliquera aux revenus 2025, avec un système d'acompte. La piste d'une contribution sur le patrimoine reste …",https://www.lesechos.fr/economie-france/budget-fiscalite/limpot-minimum-sur-les-hauts-revenus-fait-son-come-back-2142757,https://media.lesechos.com/api/v1/images/view/6787e9c3ed99c7082c6cf5c3/1280x720/01303473549566-web-tete.jpg,2025-01-15T17:00:44Z,La volte-face est surprenante. Quelques heures après avoir expliqué que les contribuables les plus aisés ne seraient pas visés cette année par la contribution différentielle sur les hauts revenus (CD… [+3004 chars]
12,"{'id': 'google-news-fr', 'name': 'Google News (France)'}",,Google News,"Comprehensive up-to-date news coverage, aggregated from sources all over the world by Google News.",https://news.google.com/rss/articles/CBMiogJBVV95cUxPNm1OeW93TG5iRVRUZFJSc1dEcGttdG4xYmhZang5QlYwcG5xc0JBNS00UW1zWUQ3LU5uRWp3RkU1di13VVpndWJyNGRYUVFhMHFWNzRUVmNwOGxDS0RrdlhJTzI4bUUzRHJDQ3VBeFlPU2xlOHBxeXJucHFuVXBnSFVFZ1ZlVFkyVEVFc3ctenhCX3dRRVEzUXM2OUxzY2lLZDY3VV9adkQ1VGxoNjhiYWMxTk5rVVhRamY1cTEyWFhXWjBzYlRLZVV3N0NoRzQ4OTg0WVdOZWItWWlCQnEwMU1hcW9Yc0N6aUkxd1ZEN1dGXzJKWDhDNXhDZWgxU2lYMkJPYlVNSHpCMUhKWXlTaTVzOWlwajJReW5UVmY3ZWpDZw,https://lh3.googleusercontent.com/J6_coFbogxhRI9iM864NL_liGXvsQp2AupsKei7z0cNNfDvGUmWUy20nuUhkREQyrpY4bEeIBuc=s0-w300-rw,2025-01-15T15:21:56+00:00,"Comprehensive up-to-date news coverage, aggregated from sources all over the world by Google News."
13,"{'id': 'google-news-fr', 'name': 'Google News (France)'}",,Google News,"Comprehensive up-to-date news coverage, aggregated from sources all over the world by Google News.",https://news.google.com/rss/articles/CBMi3gFBVV95cUxPM01SOXF4TUs0ZjAySG5CeGgzWXNZUFFwaVB6eHdBUUxXY19kUUswQ3NDa0VCZmFUUEdUZXlmYXM2a1N3eFR0RTR1a3dDVWlZUjFlYVN5dnpCaTBqdGljVnRyTzItWU5kMGVOeEo5UEpDVGs1V2N2bk5aemtjMkJ4WVVhVzNnSEpXc1FLNktubUhVQ3gtZVV5b1FKVjJYR1V0TWV3TDE3dzlrX19FLTM0X2dSUGhmdU42VHFOYVQ3aDhpeVF5WVdnd2hVTHNfMmxQLXNCVzFsMV9scThOMlE,https://lh3.googleusercontent.com/J6_coFbogxhRI9iM864NL_liGXvsQp2AupsKei7z0cNNfDvGUmWUy20nuUhkREQyrpY4bEeIBuc=s0-w300-rw,2025-01-15T14:58:58+00:00,"Comprehensive up-to-date news coverage, aggregated from sources all over the world by Google News."
14,"{'id': 'le-monde', 'name': 'Le Monde'}",Pierre-Cyrille Hautcœur,« Le monde entre dans une nouvelle ère de domination du capitalisme de la finitude »,"Dans sa chronique, Pierre-Cyrille Hautcœur revient sur le dernier livre d’Arnaud Orain, « Le Monde confisqué », qui montre le retour de la rivalité entre les puissants acteurs avides d’accaparer les ressources naturelles de notre monde fini.",https://www.lemonde.fr/economie/article/2025/01/15/le-monde-entre-dans-une-nouvelle-ere-de-domination-du-capitalisme-de-la-finitude_6499578_3234.html,https://img.lemde.fr/2023/12/27/75/0/5215/3476/1440/960/60/0/5f8c300_5200343-01-06.jpg,2025-01-15T14:30:07Z,"Un futur président des Etats-Unis qui annonce son intention de contrôler (voire dabsorber) des territoires appartenant à ses alliés, des patrons de très grandes entreprises qui refusent les règles dé… [+2040 chars]"
15,"{'id': 'les-echos', 'name': 'Les Echos'}",Elsa Dicharry,Immobilier : le marché de la location au bord de l'asphyxie,"En trois ans, l'offre de biens à louer a baissé de plus de 50 %, selon la plateforme d'annonces immobilières Bien'Ici, quand la demande augmentait de 45 %. Les professionnels anticipent une année 2025 encore plus complexe que 2024 pour les candidats à la loca…",https://www.lesechos.fr/industrie-services/immobilier-btp/immobilier-le-marche-de-la-location-au-bord-de-lasphyxie-2142697,https://media.lesechos.com/api/v1/images/view/6787c00c1316d700c455ea45/1280x720/01303462507741-web-tete.jpg,2025-01-15T14:02:47Z,"Alors que des signes d'embellie se font sentir sur le marché de la transaction d'immobilier résidentiel ancien, le marché de la location de logements - bloqué depuis de longs mois - concentre les inq… [+5260 chars]"
16,"{'id': 'google-news-fr', 'name': 'Google News (France)'}",,Google News,"Comprehensive up-to-date news coverage, aggregated from sources all over the world by Google News.",https://news.google.com/rss/articles/CBMiugFBVV95cUxNcTg3ZWhYd19kdF9XSU4zS0QxZVdKd1ZCU2ZKZnpHRHlqZUhFQXFabk9mVXowN2F4UmhLc3BpcDR3d3p0SWZwbWFEenNFd2NLSTJaX0t4bWZTNGlSMWpFbXQyenJTdXJaN2VWdDFaaWJncHdBbExOck42Y2hRdFZrN1Fkc2VtdXl6bjk2aGp6RTJPR2VucTdfWXRLYTg3YW1EUXBaRnJiMWZVWHJkR0M3a0hlSUdIZGxxNUHSAb8BQVVfeXFMUFlWeFN5ZjEyQ2U3WTJfekY2cldqUmtvNk9ERjROVnZPWjBMaDJKa3dzekljRWM0Qkh5TVdxenhXYjFkdHNBT3FIUmVOUUNGYS1TRlgwWDM4cm9lNEJOa3dhSy1TUUpGZnNHdnNoWlY1OE80b1F5UHZnOE5hU1hZUzR3Znc5RC11eGRRbTNRZmRxZjh5aGVBTkVHaEpoRllQRzhOQ3dLQ0s1bndsUFB5bHR2dHJFRlZaNFctMmFqUmc,https://lh3.googleusercontent.com/J6_coFbogxhRI9iM864NL_liGXvsQp2AupsKei7z0cNNfDvGUmWUy20nuUhkREQyrpY4bEeIBuc=s0-w300-rw,2025-01-15T11:19:25+00:00,"Comprehensive up-to-date news coverage, aggregated from sources all over the world by Google News."
17,"{'id': 'google-news-fr', 'name': 'Google News (France)'}",,Google News,"Comprehensive up-to-date news coverage, aggregated from sources all over the world by Google News.",https://news.google.com/rss/articles/CBMi1gFBVV95cUxOMlZSQlN3WjlJYXFraFpKUkVNQ3BVXzV0dVh3eDZKczlWUmZudU1YRmFEQk00WnpxdUtkbnIweHB2Ymx2cERUcnlpSFNZQm1iVzJyMHR3Z0ptWl9PbmJobGJ0QlR1VUI1VzlkZ0N2aGpmYmZYVDAxMy1BNXRhazh2NjROSll5ZGJnQllaTnZJVU5hd0VIWTVmRkdkcXpoVUNLRnBialFZOG84ell1VWUzSDNMbllDTzdzck5QS25rRThQMG9PRGJVdFVEUmFuUDFNNmtrT3hR,https://lh3.googleusercontent.com/J6_coFbogxhRI9iM864NL_liGXvsQp2AupsKei7z0cNNfDvGUmWUy20nuUhkREQyrpY4bEeIBuc=s0-w300-rw,2025-01-15T10:39:52+00:00,"Comprehensive up-to-date news coverage, aggregated from sources all over the world by Google News."
18,"{'id': 'le-monde', 'name': 'Le Monde'}",Le Monde,Déclaration de politique générale de Bayrou : le compte n’y est pas encore,"Alors que le Parti socialiste n’a pas trouvé dans les annonces du premier ministre, mardi, de signes suffisants pour sceller à ce stade un pacte de non-censure, beaucoup dépend désormais de la capacité du centriste à rompre avec la verticalité du macronisme e…",https://www.lemonde.fr/idees/article/2025/01/15/declaration-de-politique-generale-de-bayrou-le-compte-n-y-est-pas-encore_6499285_3232.html,https://img.lemde.fr/2025/01/15/0/0/5899/3933/1440/960/60/0/9fbb692_sirius-fs-upload-1-urhllqdrehuu-1736928887110-jmug250114009.jpg,2025-01-15T10:30:05Z,"La poutre bouge, mais François Bayrou nest pas encore parvenu à ses fins. Au terme de la déclaration de politique générale quil a prononcée, mardi 14 janvier, dans lHémicycle houleux de lAssemblée na… [+3250 chars]"
19,"{'id': 'le-monde', 'name': 'Le Monde'}",Philippe Escande,« Le “M. Muscle” Zuckerberg n’intéresse pas les jeunes »,"En prévision de l’interdiction de TikTok aux Etats-Unis, une partie des utilisateurs américains se tournent vers le réseau chinois Xiaohongshu (Petit Livre rouge). Un phénomène qui devrait interroger Zuckerberg, plus occupé à licencier 5 % du personnel de Met…",https://www.lemonde.fr/economie/article/2025/01/15/le-m-muscle-zuckerberg-n-interesse-pas-les-jeunes_6499284_3234.html,https://img.lemde.fr/2025/01/10/0/0/6823/4549/1440/960/60/0/50443b3_ftp-import-images-1-fd00y3mp2y5h-5706396-01-06.jpg,2025-01-15T10:28:17Z,"Dans le film américain Volte-face (1997), un policier et un truand échangent leurs visages semant la confusion : qui est le bon ? Qui est le méchant ? Les dernières apparitions et décisions de Mark Z… [+1827 chars]"
0,"{'id': 'google-news-fr', 'name': 'Google News (France)'}",,Google News,"Comprehensive up-to-date news coverage, aggregated from sources all over the world by Google News.",https://news.google.com/rss/articles/CBMi6AFBVV95cUxQWkQ5N3RiR1c2UkxGa2xwTHVNZ2UyRnU5SjVGOVBCbmo1UnRhanZBQVB4d2F4WW1DeTA2VGE3MEFvSnlQZGZzWHROQW1nNi1WTXd3a2pNOEh1UFJrYzEtRV9mb2hVV1lLOE1EeGtBNVNxTkQ0cnltZXJmZGlSSjRVRTBOUjNSX2xBZVhPTGE1VDE3TDdtbWlieE9ReHU0aDBqQUNvQ3YwcEMxZnM2aG5NeGZOOVk5T2dyX0phZl94SEN1QmM5WEFqcE5LQjNTRi1fMWxzbnZuWEhNY2tXTkNMa2ZKSWVuZVVN,https://lh3.googleusercontent.com/J6_coFbogxhRI9iM864NL_liGXvsQp2AupsKei7z0cNNfDvGUmWUy20nuUhkREQyrpY4bEeIBuc=s0-w300-rw,2025-01-15T08:52:44+00:00,"Comprehensive up-to-date news coverage, aggregated from sources all over the world by Google News."
1,"{'id': 'les-echos', 'name': 'Les Echos'}",Sandra Bouillard,Immobilier : les villes gagnantes pour investir 100.000 euros dans un logement étudiant,"La plateforme Parcoursup ouvre ce 15 janvier, préparant les élèves de terminale à l'entrée dans les études supérieures. Une réelle opportunité pour les investisseurs : la demande pour les studios explose dans certaines villes. Tour d'horizon des communes les …",https://www.lesechos.fr/patrimoine/immobilier/immobilier-les-villes-gagnantes-pour-investir-100000-euros-dans-un-logement-etudiant-2142582,https://media.lesechos.com/api/v1/images/view/67876b438bddee5d102813a8/1280x720/01303376848236-web-tete.jpg,2025-01-15T08:00:54Z,"Par Sandra Bouillard
Publié le 15 janv. 2025 à 09:00Mis à jour le 15 janv. 2025 à 09:15
En cinq ans, les places disponibles sur la plateforme Parcoursup ont bondi de 77 %. Mais à moins de continuer… [+428 chars]"
2,"{'id': 'les-echos', 'name': 'Les Echos'}",Sophie Amsili,Immobilier : les propriétaires de logements notés G peuvent-ils continuer à louer ?,"Environ 500.000 « passoires thermiques » sont interdites à la location depuis le 1 er janvier. Entre des travaux au coût prohibitif et une demande locative qui explose, des propriétaires choisissent de faire fi de la loi. Que risquent-ils ? Quelle est la resp…",https://www.lesechos.fr/patrimoine/immobilier/immobilier-les-proprietaires-de-logements-notes-g-peuvent-ils-continuer-a-louer-2142552,https://media.lesechos.com/api/v1/images/view/678747e6a6ab61233560bb16/1280x720/01303259868639-web-tete.jpg,2025-01-15T05:30:09Z,"Par Sophie Amsili
Publié le 15 janv. 2025 à 06:30Mis à jour le 15 janv. 2025 à 11:37
Il se dit « dégoûté ». Guillaume* estime avoir « fait tout ce qu'il pouvait » pour améliorer l'isolation de son … [+575 chars]"
3,"{'id': 'le-monde', 'name': 'Le Monde'}",Arnaud Leparmentier,« Les Etats-Unis ont pivoté du combat contre le réchauffement à la mobilisation en faveur de l’intelligence artificielle »,"C’est vrai, Donald Trump et son compère Elon Musk veulent déstabiliser l’Europe. Mais celle-ci, en plein décrochage depuis le tournant du siècle, est largement responsable de son funeste destin, constate Arnaud Leparmentier dans sa chronique.",https://www.lemonde.fr/idees/article/2025/01/14/les-etats-unis-ont-pivote-du-combat-contre-le-rechauffement-a-la-mobilisation-en-faveur-de-l-intelligence-artificielle_6497564_3232.html,https://img.lemde.fr/2025/01/09/0/0/6000/4000/1440/960/60/0/2bcb321_ftp-import-images-1-gj9do4vqkot4-8e7782cfe06744bca76b6581ee72eb4d-0-c37d8343fd9d4e489da9e9c2ab0820e3.jpg,2025-01-14T13:30:06Z,"Heureusement que les Européens ont Elon Musk, il leur permet de se mentir encore un peu. Certes, Emmanuel Macron et ses pairs ont raison de dénoncer cette « nouvelle internationale réactionnaire » à … [+1966 chars]"
4,"{'id': 'le-monde', 'name': 'Le Monde'}","Christian Babusiaux, Bernadette Malgorn, Emmanuel Millard","« La pauvreté a cessé de diminuer en France il y a vingt ans, et est même en augmentation »","Alors que la France compte près de 10 millions de pauvres, Christian Babusiaux, Bernadette Malgorn et Emmanuel Millard, membres du think tank Le Cercle de la réforme de l’Etat font, dans une tribune au « Monde », plusieurs propositions pour améliorer l’effica…",https://www.lemonde.fr/idees/article/2025/01/13/la-pauvrete-a-cesse-de-diminuer-en-france-il-y-a-vingt-ans-et-est-meme-en-augmentation_6495760_3232.html,https://img.lemde.fr/2015/09/10/0/5/757/505/1440/960/60/0/20edae1_2025-klsvus.jpg,2025-01-13T12:00:04Z,"Il y a plus de 9 millions de pauvres dans lHexagone, soit 14,4 % de la population, et près de 10 millions en comprenant les départements doutre-mer. Et cela, malgré des dépenses dévolues à la lutte c… [+2264 chars]"
5,"{'id': 'le-monde', 'name': 'Le Monde'}",Alexandre Piquard,« Le pouvoir des géants de la tech érode la démocratie »,"Marietje Schaake, ex-députée européenne et essayiste, dénonce, dans un entretien au « Monde », le contrôle « d’infrastructures critiques » par les patrons du numérique comme Elon Musk ou Mark Zuckerberg, désormais bienveillants envers Donald Trump.",https://www.lemonde.fr/economie/article/2025/01/13/le-pouvoir-des-geants-de-la-tech-erode-la-democratie_6495406_3234.html,https://img.lemde.fr/2025/01/11/0/0/8256/5504/1440/960/60/0/4546f14_sirius-fs-upload-1-ry9zqf9hedor-1736596064615-000-33cd2fh.jpg,2025-01-13T06:30:03Z,"Marietje Schaake, spécialiste de la régulation du numérique, lors du Sommet pour la démocratie, à Washington, le 30 mars 2023. MANDEL NGAN / AFP
Marietje Schaake a publié, en septembre 2024, The Tec… [+1363 chars]"
6,"{'id': 'le-monde', 'name': 'Le Monde'}",Mathys Vallée,Vidéo. Vidéo. Marche du 11 janvier 2015 : retour sur une mobilisation historique,"Vidéo - Il y a dix ans, quatre jours après les attentats de « Charlie Hebdo » et de l’Hyper Cacher, la France connaissait la plus grande mobilisation recensée de son histoire.",https://www.lemonde.fr/societe/video/2025/01/11/video-marche-du-11-janvier-2015-retour-sur-une-mobilisation-historique_6492452_3224.html,https://img.lemde.fr/2025/01/10/0/4/4920/3280/1440/960/60/0/96d708f_sirius-fs-upload-1-vylhfhrc7itr-1736523213796-000-par8071664.jpg,2025-01-11T08:00:07Z,"<li>Parce quune autre personne (ou vous) est en train de lire Le Monde avec ce compte sur un autre appareil.
Vous ne pouvez lire Le Monde que sur un seul appareil à la fois (ordinateur, téléphone ou… [+626 chars]"
7,"{'id': 'le-monde', 'name': 'Le Monde'}","Brieuc Beckers, Marceau Bretonnier et Elisa Bellanger",Vidéo. Attentats de « Charlie Hebdo » et de l’Hyper Cacher : le récit en vidéo des attaques terroristes de janvier 2015,"Vidéo - Entre le 7 et le 9 janvier 2015, trois terroristes tuent 17 personnes et en blessent grièvement quatre autres. Grâce à des documents rarement diffusés et au témoignage de François Molins, procureur de Paris au moment des faits, « Le Monde » reconstitu…",https://www.lemonde.fr/societe/video/2025/01/07/attentats-de-charlie-hebdo-et-de-l-hyper-cacher-le-recit-en-video-des-attaques-terroristes-de-janvier-2015_6485375_3224.html,https://img.lemde.fr/2024/12/27/96/105/1764/1176/1440/960/60/0/3d73a40_1735314157687-thumbnail-charlie-sirius-copie.jpg,2025-01-07T04:30:01Z,"Paris, 7 janvier 2015, les bureaux du journal Charlie Hebdo sont attaqués par deux terroristes. Equipés darmes de guerre, Saïd et Chérif Kouachi tuent douze personnes en lespace de quelques minutes a… [+778 chars]"
8,"{'id': 'le-monde', 'name': 'Le Monde'}","Asia Balluffier, Adrien Vande Casteele et Adrien Marchais",Vidéo. La cellule d’investigations visuelles du « Monde » vous raconte ses méthodes de travail,"Vidéo - Depuis 2019, la cellule d’investigations visuelles du « Monde » s’est érigée en modèle français du genre. Sources ouvertes (OSINT), images satellites, synchronisation d’images… Plongée dans quelques-uns de nos secrets de fabrication.",https://www.lemonde.fr/le-monde-et-vous/video/2024/12/18/80-ans-dans-les-coulisses-des-enquetes-videos-du-monde_6454832_6065879.html,https://img.lemde.fr/2024/12/16/0/150/1620/1080/1440/960/60/0/9fecd1e_1734344130277-appel-2.jpg,2024-12-18T05:00:18Z,"Documentées sur les réseaux sociaux, captées par des satellites et filmées par des milliers de témoins, les guerres en Ukraine, à Gaza ou encore en Syrie ont mis en lumière une évidence. Si Internet … [+872 chars]"
